{
  "protocol_version": "1.0",
  "message_type": "topic",
  "channel": "/robot/weapons/cannon/state",
  "sequence_number": 3,
  "simulation_tick": 18,
  "simulation_time_ns": 300000000,
  "run_id": "weapons-demo",
  "publisher_id": "module:odometry",
  "request_id": null,
  "frame_id": "base_link",
  "schema": "weapon_state@1",
  "payload": {
    "ready": false,
    "cooldown_remaining_ticks": 15,
    "shots_fired": 1,
    "hits_received": 0,
    "last_result": {
      "request_id": "shot-18",
      "status": "fired",
      "processed_tick": 18
    }
  }
}
