{
  "protocol_version": "1.0",
  "message_type": "topic",
  "channel": "/robot/estimates/odometry/pose",
  "sequence_number": 20,
  "simulation_tick": 120,
  "simulation_time_ns": 2000000000,
  "run_id": "run-demo-001",
  "publisher_id": "module:odometry",
  "request_id": null,
  "frame_id": "map",
  "schema": "pose2d@1",
  "payload": {
    "child_frame_id": "base_link",
    "x_m": 1.2,
    "y_m": 0.4,
    "yaw_rad": 0.1,
    "covariance": [
      0.04,
      0,
      0,
      0,
      0.04,
      0,
      0,
      0,
      0.01
    ]
  }
}
