{
  "protocol_version": "1.0",
  "message_type": "topic",
  "channel": "/view/snapshot",
  "sequence_number": 20,
  "simulation_tick": 126,
  "simulation_time_ns": 2100000000,
  "run_id": "run-demo-001",
  "publisher_id": "host:view",
  "request_id": null,
  "frame_id": null,
  "schema": "view_snapshot@1",
  "payload": {
    "view_revision": 4,
    "policy_id": "campaign-l3-v1",
    "selected_pose": {
      "source_id": "module:odometry",
      "frame_id": "map",
      "simulation_tick": 120,
      "freshness": "fresh",
      "pose": {
        "child_frame_id": "base_link",
        "x_m": 1.2,
        "y_m": 0.4,
        "yaw_rad": 0.1,
        "covariance": [
          0.04,
          0,
          0,
          0,
          0.04,
          0,
          0,
          0,
          0.01
        ]
      }
    },
    "local_observations": [
      {
        "protocol_version": "1.0",
        "message_type": "topic",
        "channel": "/robot/sensors/radar",
        "sequence_number": 20,
        "simulation_tick": 120,
        "simulation_time_ns": 2000000000,
        "run_id": "run-demo-001",
        "publisher_id": "sensor:radar",
        "request_id": null,
        "frame_id": "radar_link",
        "schema": "radar@1",
        "payload": {
          "detections": [
            {
              "observation_id": "obs-1",
              "range_m": 3.0,
              "bearing_rad": 0.4
            }
          ]
        }
      }
    ],
    "objects": [],
    "effects": []
  }
}
