{
  "protocol_version": "1.0",
  "message_type": "topic",
  "channel": "/robot/sensors/radar",
  "sequence_number": 20,
  "simulation_tick": 120,
  "simulation_time_ns": 2000000000,
  "run_id": "run-demo-001",
  "publisher_id": "sensor:radar",
  "request_id": null,
  "frame_id": "radar_link",
  "schema": "radar@1",
  "payload": {
    "detections": [
      {
        "observation_id": "obs-1",
        "range_m": 3.0,
        "bearing_rad": 0.4
      }
    ]
  }
}
